[
  {
    "id": "F-PQ1-001",
    "metric": "bauxite_production",
    "label": "Bauxite Production Q1",
    "value": 1883,
    "unit": "000T",
    "period": "FY2026Q1",
    "period_type": "Q",
    "basis": "consolidated",
    "level": 1,
    "parent": null,
    "source": {
      "src_id": "SRC-600",
      "quote": null
    },
    "method": "reported",
    "formula": null,
    "inputs": [],
    "confidence": "high",
    "load_bearing": true,
    "flags": []
  },
  {
    "id": "F-PQ1-002",
    "metric": "bauxite_production_qoq_pct",
    "label": "Bauxite Production QoQ % (vs Q4 FY2025)",
    "value": -1.05,
    "unit": "pct",
    "period": "FY2026Q1",
    "period_type": "Q",
    "basis": "consolidated",
    "level": 1,
    "parent": "F-PQ1-001",
    "source": {
      "src_id": "SRC-600",
      "quote": null
    },
    "method": "computed",
    "formula": "(1883 - 1903) / 1903 * 100",
    "inputs": ["F-PQ1-001"],
    "confidence": "high",
    "load_bearing": false,
    "flags": []
  },
  {
    "id": "F-PQ1-003",
    "metric": "bauxite_production_yoy_pct",
    "label": "Bauxite Production YoY % (vs Q1 FY2025)",
    "value": 6.6,
    "unit": "pct",
    "period": "FY2026Q1",
    "period_type": "Q",
    "basis": "consolidated",
    "level": 1,
    "parent": "F-PQ1-001",
    "source": {
      "src_id": "SRC-600",
      "quote": "6.6%"
    },
    "method": "reported",
    "formula": null,
    "inputs": [],
    "confidence": "high",
    "load_bearing": true,
    "flags": []
  },
  {
    "id": "F-PQ1-004",
    "metric": "bauxite_production_fy2025_full_year",
    "label": "Bauxite Production FY2025 Full Year",
    "value": 7262,
    "unit": "000T",
    "period": "FY2025",
    "period_type": "FY",
    "basis": "consolidated",
    "level": 1,
    "parent": null,
    "source": {
      "src_id": "SRC-600",
      "quote": null
    },
    "method": "reported",
    "formula": null,
    "inputs": [],
    "confidence": "high",
    "load_bearing": false,
    "flags": []
  },
  {
    "id": "F-PQ1-005",
    "metric": "alumina_hydrate_production",
    "label": "Alumina Hydrate Production Q1",
    "value": 578,
    "unit": "000T",
    "period": "FY2026Q1",
    "period_type": "Q",
    "basis": "consolidated",
    "level": 1,
    "parent": null,
    "source": {
      "src_id": "SRC-600",
      "quote": null
    },
    "method": "reported",
    "formula": null,
    "inputs": [],
    "confidence": "high",
    "load_bearing": true,
    "flags": []
  },
  {
    "id": "F-PQ1-006",
    "metric": "alumina_hydrate_production_yoy_pct",
    "label": "Alumina Hydrate Production YoY % (vs Q1 FY2025)",
    "value": 35.1,
    "unit": "pct",
    "period": "FY2026Q1",
    "period_type": "Q",
    "basis": "consolidated",
    "level": 1,
    "parent": "F-PQ1-005",
    "source": {
      "src_id": "SRC-600",
      "quote": "35.1%"
    },
    "method": "reported",
    "formula": null,
    "inputs": [],
    "confidence": "high",
    "load_bearing": true,
    "flags": []
  },
  {
    "id": "F-PQ1-007",
    "metric": "alumina_hydrate_production_fy2025_full_year",
    "label": "Alumina Hydrate Production FY2025 Full Year",
    "value": 2076,
    "unit": "000T",
    "period": "FY2025",
    "period_type": "FY",
    "basis": "consolidated",
    "level": 1,
    "parent": null,
    "source": {
      "src_id": "SRC-600",
      "quote": null
    },
    "method": "reported",
    "formula": null,
    "inputs": [],
    "confidence": "high",
    "load_bearing": false,
    "flags": []
  },
  {
    "id": "F-PQ1-008",
    "metric": "metal_aluminium_production",
    "label": "Metal (Aluminium) Production Q1",
    "value": 115,
    "unit": "000T",
    "period": "FY2026Q1",
    "period_type": "Q",
    "basis": "consolidated",
    "level": 1,
    "parent": null,
    "source": {
      "src_id": "SRC-600",
      "quote": null
    },
    "method": "reported",
    "formula": null,
    "inputs": [],
    "confidence": "high",
    "load_bearing": true,
    "flags": []
  },
  {
    "id": "F-PQ1-009",
    "metric": "metal_aluminium_production_yoy_pct",
    "label": "Metal (Aluminium) Production YoY % (vs Q1 FY2025)",
    "value": 2.7,
    "unit": "pct",
    "period": "FY2026Q1",
    "period_type": "Q",
    "basis": "consolidated",
    "level": 1,
    "parent": "F-PQ1-008",
    "source": {
      "src_id": "SRC-600",
      "quote": "2.7%"
    },
    "method": "reported",
    "formula": null,
    "inputs": [],
    "confidence": "high",
    "load_bearing": true,
    "flags": []
  },
  {
    "id": "F-PQ1-010",
    "metric": "metal_aluminium_production_fy2025_full_year",
    "label": "Metal (Aluminium) Production FY2025 Full Year",
    "value": 460,
    "unit": "000T",
    "period": "FY2025",
    "period_type": "FY",
    "basis": "consolidated",
    "level": 1,
    "parent": null,
    "source": {
      "src_id": "SRC-600",
      "quote": null
    },
    "method": "reported",
    "formula": null,
    "inputs": [],
    "confidence": "high",
    "load_bearing": false,
    "flags": []
  },
  {
    "id": "F-PQ1-011",
    "metric": "thermal_power_production",
    "label": "Thermal Power Production Q1",
    "value": 1686,
    "unit": "MU",
    "period": "FY2026Q1",
    "period_type": "Q",
    "basis": "consolidated",
    "level": 1,
    "parent": null,
    "source": {
      "src_id": "SRC-600",
      "quote": null
    },
    "method": "reported",
    "formula": null,
    "inputs": [],
    "confidence": "high",
    "load_bearing": true,
    "flags": []
  },
  {
    "id": "F-PQ1-012",
    "metric": "thermal_power_production_yoy_pct",
    "label": "Thermal Power Production YoY % (vs Q1 FY2025)",
    "value": 6.4,
    "unit": "pct",
    "period": "FY2026Q1",
    "period_type": "Q",
    "basis": "consolidated",
    "level": 1,
    "parent": "F-PQ1-011",
    "source": {
      "src_id": "SRC-600",
      "quote": "6.4%"
    },
    "method": "reported",
    "formula": null,
    "inputs": [],
    "confidence": "high",
    "load_bearing": true,
    "flags": []
  },
  {
    "id": "F-PQ1-013",
    "metric": "thermal_power_production_fy2025_full_year",
    "label": "Thermal Power Production FY2025 Full Year",
    "value": 6641,
    "unit": "MU",
    "period": "FY2025",
    "period_type": "FY",
    "basis": "consolidated",
    "level": 1,
    "parent": null,
    "source": {
      "src_id": "SRC-600",
      "quote": null
    },
    "method": "reported",
    "formula": null,
    "inputs": [],
    "confidence": "high",
    "load_bearing": false,
    "flags": []
  },
  {
    "id": "F-PQ1-014",
    "metric": "alumina_export_sales",
    "label": "Alumina Export Sales Q1",
    "value": 274.6,
    "unit": "000T",
    "period": "FY2026Q1",
    "period_type": "Q",
    "basis": "consolidated",
    "level": 1,
    "parent": null,
    "source": {
      "src_id": "SRC-601",
      "quote": null
    },
    "method": "reported",
    "formula": null,
    "inputs": [],
    "confidence": "high",
    "load_bearing": true,
    "flags": []
  },
  {
    "id": "F-PQ1-015",
    "metric": "alumina_export_sales_yoy_pct",
    "label": "Alumina Export Sales YoY % (vs Q1 FY2025)",
    "value": 206.4,
    "unit": "pct",
    "period": "FY2026Q1",
    "period_type": "Q",
    "basis": "consolidated",
    "level": 1,
    "parent": "F-PQ1-014",
    "source": {
      "src_id": "SRC-601",
      "quote": "206.4%"
    },
    "method": "reported",
    "formula": null,
    "inputs": [],
    "confidence": "high",
    "load_bearing": true,
    "flags": []
  },
  {
    "id": "F-PQ1-016",
    "metric": "alumina_export_sales_fy2025_full_year",
    "label": "Alumina Export Sales FY2025 Full Year",
    "value": 1064.6,
    "unit": "000T",
    "period": "FY2025",
    "period_type": "FY",
    "basis": "consolidated",
    "level": 1,
    "parent": null,
    "source": {
      "src_id": "SRC-601",
      "quote": null
    },
    "method": "reported",
    "formula": null,
    "inputs": [],
    "confidence": "high",
    "load_bearing": false,
    "flags": []
  },
  {
    "id": "F-PQ1-017",
    "metric": "alumina_domestic_sales",
    "label": "Alumina Domestic Sales Q1",
    "value": 29.1,
    "unit": "000T",
    "period": "FY2026Q1",
    "period_type": "Q",
    "basis": "consolidated",
    "level": 1,
    "parent": null,
    "source": {
      "src_id": "SRC-601",
      "quote": null
    },
    "method": "reported",
    "formula": null,
    "inputs": [],
    "confidence": "high",
    "load_bearing": true,
    "flags": []
  },
  {
    "id": "F-PQ1-018",
    "metric": "alumina_domestic_sales_yoy_pct",
    "label": "Alumina Domestic Sales YoY % (vs Q1 FY2025)",
    "value": 196.9,
    "unit": "pct",
    "period": "FY2026Q1",
    "period_type": "Q",
    "basis": "consolidated",
    "level": 1,
    "parent": "F-PQ1-017",
    "source": {
      "src_id": "SRC-601",
      "quote": "196.9%"
    },
    "method": "reported",
    "formula": null,
    "inputs": [],
    "confidence": "high",
    "load_bearing": true,
    "flags": []
  },
  {
    "id": "F-PQ1-019",
    "metric": "alumina_domestic_sales_fy2025_full_year",
    "label": "Alumina Domestic Sales FY2025 Full Year",
    "value": 41.4,
    "unit": "000T",
    "period": "FY2025",
    "period_type": "FY",
    "basis": "consolidated",
    "level": 1,
    "parent": null,
    "source": {
      "src_id": "SRC-601",
      "quote": null
    },
    "method": "reported",
    "formula": null,
    "inputs": [],
    "confidence": "high",
    "load_bearing": false,
    "flags": []
  },
  {
    "id": "F-PQ1-020",
    "metric": "metal_export_sales",
    "label": "Metal Export Sales Q1",
    "value": 0,
    "unit": "000T",
    "period": "FY2026Q1",
    "period_type": "Q",
    "basis": "consolidated",
    "level": 1,
    "parent": null,
    "source": {
      "src_id": "SRC-601",
      "quote": null
    },
    "method": "reported",
    "formula": null,
    "inputs": [],
    "confidence": "high",
    "load_bearing": true,
    "flags": []
  },
  {
    "id": "F-PQ1-021",
    "metric": "metal_export_sales_fy2025_full_year",